no	file name	file number	answer	result_1(0%)	result_2(random)	replace	insert	delete
3092	821195001447989	1	公路總局用路人服務中心您好敝姓吳很高興為您服務	公路總局用路人服務中心您好敝姓吳很高興為您服務	公路總局用路人服務中心您吳很高興為您服務			
3093	821195001447989	2	嘿早安你好	嘿早安你好	嘿早安			
3094	821195001447989	3	呃您是罰單哪方面的問題	呃您是罰單哪方面的問題	呃您是罰單哪方面的問題是罰單哪方面的問題			
3095	821195001447989	4	先請教先生貴姓怎麼稱呼	先請教先生貴姓怎麼稱呼	先請教先生貴姓怎麼稱呼			
3096	821195001447989	5	您是車好您是車籍呃登記地址是在南投縣這邊嘛	您是汽車好您是車籍呃登記地址是在南投縣這邊嗎	您是汽車好您是車籍呃登記地址是在這邊嗎			
3097	821195001447989	6	對阿南投市喔這邊好好	對阿南投市喔我這邊好好	不是喔我這邊好好			
3098	821195001447989	7	您稍等一下喔	您稍等一下喔	對			
3099	821195001447989	8	謝謝你囉	謝謝你囉	謝先生您囉			
3100	821195001447989	9	好您別這麼說	好您別這麼說	好您別這麼說			
3101	821195001544720	1	台北市區監理所您好敝姓王很高興為您服務	台北市區監理所您好敝姓王很高興為您服務	台北市區監理所您好敝姓陳高興為您服務			
3102	821195001544720	2	唉小姐您好我想要問一下吼我我之前那個牌照稅好像沒有繳到啊	唉小姐您好我想要問一下吼我我之前那個牌照稅好像沒有繳到啊	對您好我想一下吼我我之前那個牌照稅好像沒有繳到啊			
3103	821195001544720	3	四月份的那個牌照稅嗎	四月份的那個牌照稅嗎	四月份的牌照稅嗎			
3104	821195001544720	4	喔先生您貴姓	喔我先生您貴姓	喔我縣市			
3105	821195001544720	5	啊啊我想要上網上網繳還有辦法呃我姓王	啊啊我想要上網上網繳還有辦法呃我姓王	啊但我想要上網小孩我姓			
3106	821195001544720	6	等一下我拿一個筆來請說	等一下我哪一個筆來請說	等我那一個筆來七			
3107	821195001544720	7	嘿二七五三	嘿一二七五三	嘿一二			
3108	821195001544720	8	二七五三	二七五三	嘿			
3109	821195001544720	9	四四一六	四四一六	是			
3110	821195001544720	10	四四一六	四四一六	四四一六			
3111	821195001544720	11	嘿這就稅捐處的專線	嘿這就稅捐處的專線	嘿車主的專線			
3112	821195001544720	12	謝謝你喔byebye	謝謝你喔byebye	謝謝您byebye			
3113	821195001544720	13	再見byebye	再見byebye	再見bye			
3114	821195001544767	1	台北市區監理所您好敝姓詹很高興為您服務	台北市區監理所您好敝姓詹很高興為您服務	台北市區您好敝姓詹很高興為您服務			
3115	821195001544767	2	嗯喂小姐妳好	嗯喂小姐你好	嗯喂小姐您			
3116	821195001544767	3	是這邊為您做說明先請教怎麼稱呼小姐您	是這邊為您做說明先請教怎麼稱呼小姐您	是這邊為您做是要怎麼小姐您			
3117	821195001544767	4	呃許言午許	呃許言午許	呃許			
3118	821195001544767	5	是是我如果是唉那那那個不是有所謂的那個逾期的那個滯納金嗎	是是我如果是唉那那那個不是有所謂的那個逾期的那個滯納金嗎	是是我如他那個不是有所謂的那個逾期的那個滯納金嗎			
3119	821195001544767	6	可以做列印繳費或是網路刷卡也可以這樣	可以做列印繳費或是網路刷卡也可以這樣	列印繳費或是網路刷卡一樣作列印繳費或是網路刷卡也可以這樣			
3120	821195001544767	7	OKOK好謝謝你	OKOK好謝謝您	OK好好謝謝您			
3121	821195001544767	8	不會再麻煩了喔再見	不會再麻煩了吼再見	不會再麻煩了吼再見不會再麻煩了吼再見			
3122	821195001544141	1	公路總局用路人服務中心您好敝姓吳很高興為您服務	公路總局用路人服務中心您好敝姓吳很高興為您服務	公路總局用路人服務中心您好敝姓吳很高興服務			
3123	821195001544141	2	唉喂小姐請我想請問一下吼	唉喂小姐請我想請問一下吼	唉喂想請問一下吼			
3124	821195001544141	3	蘆洲監理站	蘆洲監理站	蘆洲監理			
3125	821195001544141	4	可以辦那個無肇事證明	可以辦那個無肇事證明	可以辦那個中心			
3126	821195001544141	5	只要是監理站都可以就對了	只要是監理站都可以就對了	只要是監理站都可以就對了			
3127	821195001544141	6	對先請教先生貴姓怎麼稱呼	對先請教先生貴姓怎麼稱呼	對先生貴姓怎麼稱呼			
3128	821195001544141	7	喔好好好好了解OK	喔好好好好了解OK	喔好好好好那好了解OK			
3129	821195001544141	8	再麻煩您囉謝謝再見	再麻煩您囉謝謝再見	再麻煩您喔再見			
3130	821195001544141	9	再麻煩您囉謝謝再見	再麻煩您囉謝謝再見	呃您囉謝謝			
3131	821195001544142	1	公路總局用路人服務中心您好敝姓詹很高興為您服務	公路總局用路人服務中心您好敝姓詹很高興為您服務	公路總局用路人服務中心您好敝姓詹很高興為您服務			
3132	821195001544142	2	喂不好意思我想請問一下啊我計程車要改自用我可以沿用黃色嗎	喂不好意思我想請問一下我計程車要改自用我可以沿用黃色嗎	喂不好意思我想問一下啊我計程車要改自用我可以驗驗證嗎			
3133	821195001544142	3	呃先請教怎麼稱呼先生	呃先請教怎麼稱呼先生	呃先生怎麼稱呼先生			
3134	821195001544142	4	唉我姓張	唉我姓張	唉我姓			
3135	821195001544142	5	呃一定要改顏色可是自用車不是也有黃色的	呃一定要改顏色可是自用車不是也有黃色的	呃一定要改顏色可是自用車不是也有黃色			
3136	821195001544142	6	呃但是他的黃色不是這一種的是比較不一樣的他是有分色分顏色的	呃但是他的黃色不是這一種的是比較不一樣的他是有分色分顏色的	呃他的黃色一種的是比較不一樣的他是有分色分了			
3137	821195001544142	7	一定要改不能不能沿用原本的顏色	一定要改不能不能沿用原本的顏色	一定要改直接您了			
3138	821195001544142	8	對沿用這個計程車這種黃是不行的	對沿用這個計程車這種黃是不行的	這個情況是不行的			
3139	821195001544142	9	喔好那我知道了好謝謝	喔好那我知道了好謝謝	喔好那我知道了好謝謝			
3140	821195001544142	10	不會麻煩了	不會麻煩了	不會麻煩			
3141	821195001544184	1	公路總局用路人服務中心你好敝姓吳很高興為您服務	公路總局用路人服務中心你好敝姓吳很高興為您服務	公路總局用路人服務中心你好敝姓很高興為您服務			
3142	821195001544184	2	您是說台七三十三十二	您是說台七三十三十二	您是說臺七三			
3143	821195001544184	3	到三十三K那附近	到三十三K那附近	到三十三K那附近			
3144	821195001544184	4	先請教先生貴姓怎麼稱呼	先請教先生貴姓怎麼稱呼	先生貴姓怎麼稱呼			
3145	821195001544184	5	呃雙人徐	呃雙人徐	呃雙人徐			
3146	821195001544184	6	OK好謝謝	OK好謝謝	OK謝謝謝謝			
3147	821195001544184	7	我能請問一下您是今天晚晚上會行經是嗎	我能請問一下您是今天晚晚上會行經是嗎	我能請問一下您是今天上會行經是嗎			
3148	821195001544184	8	喔好等一下喔不好意思	喔好等一下喔不好意思	等一下喔不好意思不好意思			
3149	821195001544148	1	公路總局用路人服務中心您好敝姓吳很高興為您服務	公路總局用路人服務中心您好敝姓吳很高興為您服務	公路總局用服中心您好敝姓吳很高興為您服務			
3150	821195001544148	2	不好意思我先請教先生貴姓怎麼稱呼	不好意思我先請教先生貴姓怎麼稱呼	喔好請教先生貴姓怎麼稱呼			
3151	821195001544148	3	嗯您是針對考照方面的嗎	呃您是針對考照方面的嗎	呃您是針對考照方面的嗎			
3152	821195001544148	4	好等一會喔	好等一會喔	好等一下			
3153	821195001512640	1	台北市區監理所您好	台北市區監理所您好	台北市區監理所您好			
3154	821195001512640	2	一下吼就是說機車要報廢的話嘛吼	一下吼就是說機車要報廢的話蠻厚	一下吼機車要報廢的話然後			
3155	821195001512640	3	然後不是本人的話	然後我不是本人的話	然後不是這邊的話			
3156	821195001512640	4	那要有有要幫他報廢的話我要帶什麼證件捏	那要有有要幫他報廢的話我要帶什麼證件也	那要幫他報廢的話為什麼證件也			
3157	821195001512640	5	呃先生怎麼稱呼您	呃先生怎麼稱呼您	嗯怎麼稱呼您			
3158	821195001512640	6	呃敝姓駱	呃敝姓駱	嘿BC			
3159	821195001512640	7	好駱先生您好跟您說明一下就是第一個機車的車牌要帶著	好如果先生您好跟您說明一下就是第一個機車的車牌要帶著	好如果先生您好跟您說明一下就是機機車的車牌要帶著			
3160	821195001512640	8	然後行照	然後行照	然後行照行照			
3161	821195001512640	9	然後雙方的身份證的正本跟印章	然後雙方的身份證的正本跟印章	然後雙方的是的正本跟印章			
3162	821195001512640	10	好啊如果說已經過世了呢	好啊如果說已經過期了呢	好啊如果說一直呢			
3163	821195001512640	11	呃如果說是過世的呃您稍等我幫您確認一下喔	呃如果說是過世的呃您稍等我幫您確認一下喔	呃如果說是過期的呃您稍等我幫你一下喔			
3164	821195001512682	1	公路總局用路人服務中心您好敝姓吳很高興為您服務	公路總局用路人服務中心您好敝姓吳很高興為您服務	公路總局用路人服務中心您好敝姓為您服務			
3165	821195001512682	2	呃喂小姐你好	呃喂小姐你好	呃喂小姐你好			
3166	821195001512682	3	是我想請教一下吼我這邊是在台中的地區	是我想請教一下吼我這邊是在台中的地區	是我想請教一下吼我這邊是在台中的地區我想請教一下吼我這邊是在台中的地區			
3167	821195001512682	4	這高高鐵不是公路總局這邊的業務範圍捏不好意思	這高高鐵不是公路總局這邊的業務範圍捏不好意思	這高高鐵不是公路總局轉為捏不好意思			
3168	821195001512682	5	高鐵橋下	高鐵橋下	然後七七啊			
3169	821195001512682	6	您是指省道部分嗎還是	您是指省道部分嗎還是	您的部分嗎還是			
3170	821195001512682	7	省道這不是嘛吼	省道這不是嘛吼	省道這不是嘛吼這不是嘛吼			
3171	821195001512682	8	我先請教小姐貴姓怎麼稱呼	我先請教小姐貴姓怎麼稱呼	請教貴姓怎麼稱呼			
3172	821195001512682	9	我姓陳耳東陳	我姓陳耳東陳	我姓陳耳東			
3173	821195001512682	10	陳小姐您好	陳小姐您好	小姐您好			
3174	821195001512682	11	其他的相關窗口	其他的相關窗口	其他的銷			
3175	821195001512682	12	你是指說說唉你你你你剛是說要提供那個	你是指說說唉名剛是說要提供那個	你是指說說唉零剛是說要提供			
3176	821195001512682	13	呃沒有您您這邊您看先生先致電到那個為呃交通部為民服務中心那	呃沒有您您這邊您看先生先致電到那個喂呃交通部為民服務中心那	呃沒有您您這邊您看先生先致電的為呃交通部為民服務中心那			
3177	821195001512682	14	好哇好哇	好哇好哇	好等我			
3178	821195001512682	15	嘿對那他的電話是零八零零	嘿對那他的電話是零八零零	嘿對那他的電話是零八零零			
3179	821195001512682	16	是交通部的為民服務的專線嘛	是交通部的為您服務的專線嗎	是交通部的為您服務			
3180	821195001512682	17	為服中呃為民服務中心的專線	喂服務中心呃為您服務中心的專線	喂服務中心呃喂中心的專線			
3181	821195001512682	18	好OK	好OK	好OK			
3182	821195001512682	19	嗯吼謝謝你	嗯好謝謝你	嗯好謝謝嗯			
3183	821195001512682	20	不好意思喔	不好意思喔	嘿			
3184	821195001512682	21	麻煩了謝謝	麻煩了謝謝	好謝謝您了謝			
3185	821195001512641	1	台北市區監理所您好敝姓陳高興為您服務	台北市區監理所您好敝姓陳很高興為您服務	台北市區監理所您好敝姓陳高興為您服務			
3186	821195001512641	2	嗯秦小姐你好是請教一下我那個汽車燃料費吼啊我們是收到	嗯秦小姐您好是請教一下我那個汽車燃料費吼啊我們是收到	嗯秦小姐您好是請教一下我那個汽車燃料費吼啊我們吸收小姐您好是請教一下我那個汽車燃料費吼啊我們是收到陳			
3187	821195001512641	3	好的先請教您貴姓怎麼稱呼	好的先請教您貴姓怎麼稱呼	好的先請敝姓怎麼稱呼請教您貴姓怎麼稱呼			
3188	821195001512641	4	我姓黃草頭黃	我姓黃草頭黃	姓黃草頭黃			
3189	821195001512641	5	黃先生您好我們到超商去可以補單繳費喔	黃先生您好我們到超商去可以補單繳費喔	黃先生我們到超商去可以補單繳費喔			
3190	821195001512641	6	超商繳費就可以了	超商繳費就可以了	超商繳費就可以			
3191	821195001512641	7	對超商有一台機器可以補單	對超商有一台機器可以補單	對超商台機器可以補單			
3192	821195001512641	8	喔這樣子啊那補單的話這個要過那個過過期的話要會不會有罰款捏	喔這樣子啊那補單的話這個要過那個過過期的話要會不會有罰款耶	喔這樣子啊那補單的話這個要過那個過過期的話要會不會有換也這樣子啊那補單的話這個要過那個過過期的話要會不會有罰款耶			
3193	821195001512641	9	目前還不會有直接趕快去補單繳就可以了	目前還不會有直接趕快去補單繳就可以了	目前還是直接趕快去補單繳			
3194	821195001512641	10	補單繳就可以了	補單繳就可以了	補單繳就可以了			
3195	821195001512641	11	你們便利商店五間都可以補單單就對了	你們便利商店五間都可以補單單就對了	你們便利商我可以補單單就對了			
3196	821195001512641	12	對儘快去繳就可以了	對儘快去繳就可以了	唉去就可以了			
3197	821195001512641	13	好再麻煩了謝謝您再見	好再麻煩了謝謝您再見	好再麻煩了謝謝你			
3198	821195001512602	1	台北市區監理所您好敝姓陳高興為您服務	台北市區監理所您好敝姓陳很高興為您服務	台北市區監理所您好敝姓陳高興為您服務			
3199	821195001512602	2	我剛接到一個簡訊他說什麼我的什麼過戶完成那是怎樣	我剛接到一個簡訊他說什麼我的什麼過戶完成那是怎樣	我剛接到一個他說什麼過戶完成那是怎樣			
3200	821195001512602	3	過戶完成了對車子過戶嗎還是過戶給別人嗎	過戶完成了對車子過戶嗎還是過戶給別人嗎	過戶完成了對車子過戶護照			
3201	821195001512602	4	那上面的車號也是您不認識的	那上面的車號也是您不認識的	嗯的車號也是您不認識的			
3202	821195001512602	5	嗯也是不認識的	嗯也是不認識的	哼義務人是的			
3203	821195001512602	6	好的請問您貴姓怎麼稱呼	好的請問您貴姓怎麼稱呼	好的請問您貴姓怎麼稱呼			
3204	821195001512602	7	呃敝姓陳	呃敝姓陳	敝姓陳			
3205	821195001512602	8	陳先生您好對那有可能別的民眾把電話留成您的喔	陳先生您好對那有可能別的民眾把電話留成您的喔	陳先生您好對那有可能別的民眾打電話您的喔			
3206	821195001512602	9	喔是這樣嗎	喔我姓這樣嗎	呃楊嗎			
3207	821195001512602	10	喔沒關係	喔沒關係	喔我們七			
3208	821195001512602	11	我這樣這樣沒關係不用了	我這樣這樣沒關係不用了	我這樣沒關係不用了			
3209	821195001512602	12	是好的我知道了不好意思麻煩您了謝謝您再見	是好的我知道了不好意思麻煩您了謝謝您再見	是好的我知道了不好意思您再見			
3210	821195001512685	1	不好意思電話忙線中請您稍後一下喔	不好意思電話忙線中請您稍後一下喔	不好意思電話忙線中請您稍後一下喔			
3211	821195001512644	1	公路總局用路人服務中心您好敝姓陳很高興為您服務	公路總局用路人服務中心您好敝姓陳很高興為您服務	用路人服務中心您好敝姓陳很高興為您服務用路人服務中心您好敝姓陳很高興為您服務			
3212	821195001512644	2	唉陳小姐您好	唉陳小姐您好	唉陳小姐			
3213	821195001512644	3	我這個是高速公路的用路人	我這個是高速公路的用路人	我是高速公路的用路人			
3214	821195001512644	4	嘿我現在有一台那個阿囉哈二七七AC	嘿我現在有一台那個阿囉哈二七七AC	嘿我現在有一台那個阿囉哈二七七AC			
3215	821195001512644	5	中線是先請教先生貴姓怎麼稱呼	中線是先請教先生貴姓怎麼稱呼	中線是先請教先生貴姓怎麼稱呼			
3216	821195001512644	6	林雙木林	林雙木林	林雙木林			
3217	821195001512644	7	好是不好意思林先生	好是不好意思林先生	好是不好意思林先生是不好意思林先生			
3218	821195001512644	8	這邊的話您是呃行駛在哪一條路上面	這邊的話您是呃行駛在哪一條路上嗎	這邊的話您是二八一天嗎			
3219	821195001512644	9	國道一號南下	國道一號南下	國道一			
3220	821195001512644	10	國道一號南下嗎	國道一號南下嗎	國道南下嗎			
3221	821195001512644	11	您是說他的車號是	您是說他的車號是	您是說車號是說他的車號是			
3222	821195001512644	12	二七七AC	二七七AC	二七七ACBC			
3223	821195001512644	13	二七七嗎	二七七嗎	二七七嗎一起嗎			
3224	821195001512644	14	嘿AC	嘿D	D			
3225	821195001512644	15	A七嗎	AT嗎	T嗎			
3226	821195001512644	16	AC	ABC	嗯			
3227	821195001512644	17	喔不好意思AC嗎好沒關係嗯	喔不好意思AC嗎好沒關係嗯	喔不好意思嗎好C嗯			
3228	821195001512644	18	您是說他一直走中線然後	您是說他一直走中線然後	您是說他一直走中線然後說他一直走中線然後			
3229	821195001512644	19	是所以您本來是在外線對行駛然後您想要超車	是所以您本來是在外線對信息然後您想要超車	是所以您本來是在外線對行駛然後您下車			
3230	821195001512644	20	結果他加速不讓我超可是外面沒車沒車他也不出去	結果他加速不讓我超可是外面沒車沒車他也不出去	結果他加速不讓可是外面沒車沒車他也不出去			
3231	821195001512644	21	對就一直佔據在中間	對就一直佔據在中間	對就一起站去驗			
3232	821195001512644	22	是我這邊幫您記錄	是我這邊幫您記錄	這邊幫您記錄我這邊幫您記錄呃這邊幫您記錄我這邊幫您記錄			
3233	821195001512644	23	對呃跟您確認一下喔您是說您本來是在外線行駛	對呃跟您確認一下喔您是說您本來是在外線行駛	對人一下喔您是說您本來是在外線是			
3234	821195001512644	24	是然後呃這一台客運他是在中線嗎	是然後呃這一台客運他是在中線嗎	是然後呃這一台客運中線嗎			
3235	821195001512644	25	對他就一直在中線	對他就一直在中線	對他久一點			
3236	821195001512644	26	是所以您是本來行駛在外面他在中間然後您想要超越他到中線	是所以您是本來行駛在外面他在中間然後您想要超越他到中線	是所以您是本來行駛在外面他在中間然後您想要超越他到中線			
3237	821195001512644	27	然後現在快到西螺服務區他他還是一樣在中線	然後現在快到西螺服務區他他還是一樣在中線	然後現在快到西螺服務區他他還是在中線			
3238	821195001512644	28	是所以他現在一樣行駛在中線	是所以他現在一樣行駛在中線	是所以現在在中線			
3239	821195001512644	29	是您是開自用小客車嗎	是您是開自用小客車嗎	是您是小客車			
3240	821195001512644	30	唉我現在兩百沒有我一樣是貨運的	唉我現在兩百沒有我一樣是貨運的	唉我現在沒有我一樣是吼			
3241	821195001512644	31	啊可是我們公司有速限對	啊可是我們公司有速限對	啊可是我們公司無限對			
3242	821195001512644	32	所以您在不好意思這邊再問一句就是您在這中間呃有跟客運的駕駛	所以您在不好意思這邊再問一句就是您在這中間呃有跟客運的駕駛	所以您在不好意思這邊再問一就是您在這中間呃有跟客運的駕駛			
3243	821195001512644	33	是您是如何如何跟他們示意的	是您是如何如何跟他們示意的	是您是了跟他們示意的			
3244	821195001512644	34	可是他沒有做任何反應甚至還減慢速度這樣	可是他沒有做任何反應甚至還減慢速度這樣	可是他沒有做任何反應甚至還間五都這樣			
3245	821195001512644	35	是所以您是本來從外線行駛想要到中線	是所以您是本來從外線行駛想要到中線	所以您是本來從外線行駛想要到中線			
3246	821195001512644	36	對然後他就加速不讓我超越	對然後他就加速不讓我超越	對然後他就加速預約			
3247	821195001512644	37	然後現在到西螺服務區了他還是在中線	然後現在到西螺服務區了他還是在中線	然後信儒過期了他還是在中線			
3248	821195001512644	38	是所以您是想要	是所以您是想要	可以您是想要			
3249	821195001512644	39	是所以您是沒有行車記錄器的	是所以您是沒有行車記錄器的	是所以您是沒有行車記錄器的嗯所以您是沒有行車記錄器的您是沒有行車記錄器的嗯所以您是沒有行車記錄器的			
3250	821195001512644	40	對沒有我們只有照後面的啊我們前面沒有啊	對沒有我們只有繳後面的啊我們前面沒有啊	對你們只有繳還沒有啦			
3251	821195001512644	41	對他就減速了	對他就減速了	對他			
3252	821195001512644	42	呃不好意思麻煩您再說一次	呃不好意思麻煩您再說一次	呃不好意思您再說一次不好意思麻煩您再說一次			
3253	821195001512644	43	然後要從外線超車他也不讓我們借過也不讓我們過這樣子	然後要從外線超車他也不讓我們借過也不讓我們過這樣子	然後要從外線超車他也不讓我們借過也不讓我們過這樣子			
3254	821195001512644	44	對然後覺得蠻蠻困擾的啦不然也不會打擾你們	對然後覺得蠻蠻困擾的來不然也不會打擾您了	覺得蠻蠻困擾不然要要您們			
3255	821195001512644	45	呃我了解那請問一下呃上面是有呃機那個司機的姓名嗎	呃我了解那請問一下呃上面是有呃進那個司機的姓名嗎	呃我了解那請問一下呃上面是有呃機那個司機的零			
3256	821195001512644	46	沒有沒有	沒有沒有	沒有沒有			
3257	821195001512644	47	沒有好現在好像都沒了只剩下我只看到二二七七AC這樣	沒有好現在好像都沒了只剩下我記看到二二七七AC這樣	沒有好像都沒了下我記看到唉可以司機這樣			
3258	821195001512644	48	呃不用不用就是純粹反應而已啊	呃不用不用就是純粹反應而已啦	呃不用不用就是純粹反應而已啦不用不用就是純粹反應而已啦			
3259	821195001512644	49	嘿對對對啊也不想麻煩您們啊只是這種對啊	嘿對對對啊也不想麻煩您們他其實這種對啊	嘿的也不想麻煩您們他其實這種對啊			
3260	821195001512644	50	那這邊的話我就幫您記錄然後請承辦人員處理	那這邊的話我就幫您記錄然後請承辦人員處理	那這邊的話我就幫您入帳請承辦人員處理			
3261	821195001512644	51	是好那這邊就幫您記錄喔	是好那這邊就幫您記錄喔	是好那張您紀錄喔			
3262	821195001512644	52	好謝謝不好意思啊	好謝謝不好意思啦	不好意思			
3263	821195001512644	53	謝謝你的來電	謝謝您的來電	謝謝您的來電			
3264	821195001512644	54	好謝謝您	好謝謝您	簡嗯			
3265	821195001512644	55	謝謝您來電再見	謝謝您來電再見	謝謝您來電再見			
3266	821195001512644	56	好byebye	好byebye	好byebye			
3267	821195001512603	1	台北市區監理所您好敝姓吳很高興為您服務	台北市區監理所您好敝姓吳很高興為您服務	台北市區就敝姓吳很您服務			
3268	821195001512603	2	是先請教您貴姓怎麼稱呼	是先請教您貴姓怎麼稱呼	是先請教您貴姓怎麼稱呼先請教您貴姓怎麼稱呼			
3269	821195001512603	3	李木子李	李木子李	ZBBZ			
3270	821195001512603	4	李小姐您好您您說應到案處所是新北市	李小姐您好您您說應到案處所是新北市	李小姐您好您您說應到案處所是新北市您您說應到案處所是新北市			
3271	821195001512603	5	但是那我被開罰的地點是台北市唉	但是那我被開罰的地點是台北市唉	但是那我被開罰的地點是台北市唉			
3272	821195001512603	6	好那我給您新北市裁決處的電話您向他們詢問	好那我給您新北市裁決處的電話您向他們詢問	好那一您新北市裁決處的電話您向他們詢問			
3273	821195001512603	7	是那電話是零二	是那電話是零二	是零二			
3274	821195001512603	8	八九七八	八九七八	八九			
3275	821195001512603	9	八九七八	八九七八	八九			
3276	821195001512603	10	六一零一	六一零一	六一零一			
3277	821195001512603	11	六一零一好好謝謝	六一零一好好謝謝	六一零一號啊			
3278	821195001512603	12	唉分機是八七三到八七八	唉分機是八七三到八七八	唉分機八七三八七八			
