no	file name	file number	answer	result_1(0%)	result_2(random)	replace	insert	delete
9199	821195001513279	3	過期了啊到哪裡繳比較好	過期了啊到哪裡繳比較好	過來到哪裡繳比較好			
9200	821195001513279	4	先生貴姓怎麼稱呼	先生貴姓怎麼稱呼	先生貴姓怎麼			
9201	821195001513279	5	我姓陳我在三重	我姓陳我三三種	我姓程我再請承我在三種			
9202	821195001513279	6	陳先生您直接到便利超商的多媒體機補單列印一天了可以嗎	陳先生您直接到便利超商的多媒體機補單列印一天了可以嗎	陳小姐到便利超商多媒體機補單一天了可以嗎			
9203	821195001513279	7	您要去多媒體機補單列印喔	您要去多媒體機補單列印吼	您要去多媒體機補單列印喔			
9204	821195001513279	8	多媒體機就是超商裡面的那個像seven是ibon機	多媒體機就是超商裡面的那個像seven是的登記	多媒體機就是超商裡面的那個像seven是的登記			
9205	821195001513279	9	您要去按新的單子出來繳	您要去按新的單子出來繳	您要去按C單子出來繳您要去按新的單子出來繳			
9206	821195001513279	10	喔這樣喔	喔這樣喔	喔			
9207	821195001513279	11	然後您在那個右下角就會看到汽燃費的選項了	然後您在那個右下角就會看到汽燃費的選項了	然後您在那要就會看到汽燃費的選項了			
9208	821195001513279	12	汽燃費喔	汽燃費喔	好			
9209	821195001513279	13	對您按進去之後輸入車牌號碼跟車主資料就可以印出來櫃檯繳	對您按進去之後輸入車牌號碼跟車主資料就可以印出來櫃檯繳	對您按進去之後輸入車牌號碼跟就可出來櫃檯繳唉您按進去之後輸入車牌號碼跟車主資料就可以印出來櫃檯繳			
9210	821195001513279	14	好好好好好謝謝你喔	好好好好好謝謝你喔	好好好好好謝謝你喔			
9211	821195001513279	15	請問需要其他服務嗎	請問需要其他服務嗎	請問需要其他服務嗎			
9212	821195001513279	16	好好好好	好好好好	好好好好好			
9213	821195001546668	1	公路總局用路人服務中心您好敝姓戴很高興為您服務	公路總局用路人服務中心您好敝姓戴很高興為您服務	公路總局用路人服務中心您好敝姓戴很高			
9214	821195001546668	2	好瞭解先生貴姓怎麼稱呼您	好了解先生貴姓怎麼稱呼您	好了解先生貴姓怎麼稱呼您			
9215	821195001546668	3	陳先生您好是您說臺八十八線大寮往鳳山方向在八點	陳先生您好是您說臺八十八線大寮往鳳山方向在八點	車號是您說臺八十八線大寮往鳳山方向在八點			
9216	821195001546668	4	八點一的地方	八點一的地方	八一方			
9217	821195001546668	5	八點一的地方呃內線還是外線車道呢	八點一的地方呃內線還是外線車道呢	bye地方呃內線還是要呢			
9218	821195001546668	6	外線車道有廢一個輪胎	外線車道有廢一個輪胎	外線車道有廢一個輪胎到有廢一個輪胎			
9219	821195001546668	7	嘿對對對對	嘿對對對對	嘿對對對對			
9220	821195001546668	8	好好謝謝	好好謝謝	好好謝謝			
9221	821195001543704	1	臺北市區監理所您好敝姓詹很高興為您服務	台北市區監理所您好敝姓詹很高興為您服務	唉監理所您好敝姓詹很高興為您服務			
9222	821195001543704	2	喂你好不好意思可以幫我是轉一三零或三零三嗎	喂你好不好意思可以幫我是轉一三零或三零三嗎	喂你好不轉一三零或三零三嗎			
9223	821195001543704	3	呃先請教怎麼稱呼小姐	呃先請教怎麼稱呼小姐	呃先請教怎麼稱呼小姐			
9224	821195001543704	4	簡簡單的簡	簡簡單再見	減再見			
9225	821195001543704	5	簡小姐您好請問有什麼問題呢	簡小姐您好請問有什麼問題呢	減您好請問有什麼問題呢陳小姐您好請問有什麼問題呢小姐您好請問有什麼問題呢陳小姐您好請問有什麼問題呢			
9226	821195001543704	6	呃我昨天有傳真我想問	呃我昨天有傳真我想問	呃我先有傳真我想問			
9227	821195001543704	7	喔通訊地址的表單	喔通訊地址的表單	喔通訊地址的表單			
9228	821195001543704	8	呃傳真通訊地址的表單嗎	呃傳真通訊地址的表單嗎	呃傳真同意表單嗎			
9229	821195001543704	9	呃了解那請問一下有沒有大名我幫您做核對	呃了解那請問一下有沒有大名我幫您做核對	呃了解那請問一下有沒有大名是我核對			
9230	821195001543704	10	平安的安安開秀	平安的安安開秀	平安秀			
9231	821195001543704	11	安開秀嗎	安開秀嗎	安開秀嗎			
9232	821195001543704	12	稍等一下喔	稍等一下喔	稍等一下喔我一下喔			
9233	821195001546356	1	臺北市區監理所敝姓常很高興為您服務	台北市區監理所敝姓常很高興為您服務	台北市區監理所敝姓常很高興為您服務A市區監理所敝姓常很高興為您服務			
9234	821195001546356	2	嗯小姐你好我想請教一下吼	嗯小姐你好我想請教一下吼	嗯小姐你好我想請教一下吼			
9235	821195001546356	3	設櫃在那邊	設櫃在那邊	是不會再見			
9236	821195001546356	4	就是有那個就是有個繳稅的專櫃的那個就可以就可以	就是有那個就是有個繳稅的專櫃的那個就可以就可以	就是有那個就是有個繳稅的這個就可以就可以			
9237	821195001546356	5	如果它們牌照稅有在那邊設櫃的話就可以	如果它們牌照稅有在那邊設櫃的話就可以	嗯哼牌照稅有在那邊設櫃的話就			
9238	821195001546356	6	對是我知道了	對是我知道了	對是我知道意思			
9239	821195001546356	7	是再麻煩您是好	是再麻煩您是好	麻煩您是			
9240	821195001546356	8	感謝您的來電再見	感謝您的來電再見	感謝您的來件的來電再見			
9241	821195001543474	1	斗南你們那裡不就是斗南工務段嗎	斗南你們那裡不就是斗南工務段嗎	斗南你們那裡不就是斗南嗎			
9242	821195001543474	2	我們這裡是公路總局用路人服務中心	我們這裡是公路總局用路人服務中心	我們這裡是公路總局路人服務中心			
9243	821195001543474	3	我們是接全省的快速道路喔或省道對	我們是接全省的快速道路喔或省道對	我們是接全省道路吼或省道對			
9244	821195001543474	4	不好意思	不好意思	喔是			
9245	821195001543474	5	我有幫您確認到這個是斗南工務段負責的	我有幫您確認到這個是斗南工務段負責的	我有幫您確認斗南工務段負責的有幫您確認到這個是斗南工務段負責的			
9246	821195001543474	6	那他們的電話是零五	那他們的電話是零五	那吋的電話			
9247	821195001543474	7	一零一四	一零一四	一零一四			
9248	821195001543474	8	我要找誰呢	我要找誰呢	我要正			
9249	821195001543474	9	呃就是這個工務段的承辦	呃就是這個工務段的承辦	呃就是正本			
9250	821195001543474	10	對零五五九七一零一四	對零五五九七一一零意思	對零五五七零四			
9251	821195001543474	11	謝謝您好byebye	謝謝您好byebye	謝謝您byebye嗯您好byebye點您好byebye嗯您好byebye			
9252	821195001543474	12	唉我還有什麼地方可以為您	唉我還有什麼地方可以為您	唉我還有什麼地方可以為您			
9253	821195001543474	13	沒有謝謝你了謝謝好再見	沒有謝謝你了謝謝好再見	沒有了謝謝好再見			
9254	821195001543474	14	是感謝您的來電再見	是感謝您的來電再見	是但現在			
9255	821195001546083	1	臺北市監理所您好敝姓詹很高興為您服務	台北市監理所您好敝姓詹很高興為您服務	台北市監理所您好敝姓傅為您服務			
9256	821195001546083	2	好了解先請教怎麼稱呼小姐先生您	好了解先請教怎麼稱呼小姐先生您	好了解先怎麼稱呼小姐先生您			
9257	821195001546083	3	呃林先生您好您是說就是說繳銷的文件沒有給您這樣您是做繳銷嗎	呃林先生您好您是說就是說繳銷的文件沒有給您這樣您是做繳銷嗎	先生您好您是說就是說繳銷的文件沒有給您這樣您是做繳銷嗎			
9258	821195001546083	4	對我昨天繳銷車牌	對我昨天繳銷車牌	對我小車			
9259	821195001546083	5	是到八德路這邊嗎	是到八德路這邊嗎	是到八德路這邊嗎比較這邊嗎			
9260	821195001546083	6	不是是在士林但是我現在人在八德	不是是在士林但是我現在人在八德	是在士林但是我現在人在			
9261	821195001546083	7	呃所以您是想詢問說八德這邊是不是可以做補發嗎	呃所以您是想詢問說八德這邊是不是可以做補發嗎	呃所以您是想詢問說八德這邊是必做補發嗎			
9262	821195001546083	8	對補發那個繳銷登記書這樣子	對補發那個繳銷登記書這樣子	對補發那個繳銷登記書這樣子繳銷登記書這樣子			
9263	821195001546083	9	呃有沒有車牌號碼	呃有沒有車牌號碼	呃沒有車牌			
9264	821195001546083	10	唉等一下喔我看一下喔那個AKY	唉等一下喔我看一下喔那個AKY	唉登記看一下喔那個AKY			
9265	821195001546083	11	AKY	AKY	嘿			
9266	821195001546083	12	三零八九	三零八九	三零			
9267	821195001546083	13	呃這邊的話請問一下呃車主大名	呃這邊的話請問一下呃車主大名	呃這邊的話一下二七			
9268	821195001546083	14	唉余仲凱	唉余仲凱	唉余好			
9269	821195001546083	15	喔好您稍等一下喔我先為您做確認請您稍等謝謝	喔好您稍等一下喔我先為您做確認請您稍等謝謝	喔好您稍等一下喔我先為您做確認請謝謝喔好您稍等一下喔我先為您做確認請您稍等謝謝			
9270	821195001546042	1	公路總局用路人服務中心您好敝姓詹很高興為您服務	公路總局用路人服務中心您好敝姓詹很高興為您服務	公路總局用路人服務中心您好詹很您服務			
9271	821195001546042	2	呃先請教怎麼稱呼小姐	呃先請教怎麼稱呼小姐	呃姓怎麼稱呼小姐			
9272	821195001546042	3	我姓廖不好意思	我姓廖不好意思	我姓許			
9273	821195001546042	4	呃廖小姐您好您是說大型是類似甲類的流那種遊覽車嗎	呃廖小姐您好您是說大型是類似甲類的流那種遊覽車嗎	呃廖小姐您好您是說打是甲類的流那種遊覽車嗎			
9274	821195001546042	5	對他是二十人座的呃他是寫二十紅牌營業用二十人大客車	對他是二十人說的呃他是寫二十紅牌營業用二十人大客車	對他是二十人說寫二十紅牌營業用二十人大客車			
9275	821195001546042	6	六十五歲內	六十五歲內	六十五歲			
9276	821195001546042	7	對六十五歲以上不行的	對六十五歲以上不行的	對六十歲以上不行的			
9277	821195001546042	8	喔啊那請問一下呃那相對四十三人大客車也是一樣的規定嗎	喔啊那請問一下呃那相對四十三人大客車也是一樣的規定嗎	喔啊那請問一下呃那相對四十三人大客車有規定嗎			
9278	821195001546042	9	對也是一樣只要是大型車種的話就是六十三歲呃六十五歲	對也是一樣只要是大型車種的話就是六十三歲呃六十五歲	對也是一樣只要是大型車種的話就是有所以二六四			
9279	821195001546042	10	嗯這個部分要幫您確認一下	嗯這個部分要幫您確認一下	這個部分要幫您確認一下			
9280	821195001546001	1	賴先生您好	賴先生您好	賴先生先生您好您好先生您好			
9281	821195001546001	2	我幫您確認的確是有這個這個資訊那我這邊提供您這個電話	我幫您確認的確是有這個這個資訊那我這邊提供您這個電話	我幫您確認的確是有這個這個這邊提供您這個電話幫您確認的確是有這個這個資訊那我這邊提供您這個電話			
9282	821195001546001	3	唉可是唉因為我有打去第五養護工程處	唉可是啊因為我有打去第五養護工程處	是啊因為我有打去第五養護工程處			
9283	821195001546001	4	他說是他們很多人都不知道然後我我才打那個	他說是他們很多人都不知道然後我我才打那個	他說是他們很多人繳然後那個			
9284	821195001546001	5	喔我這邊有分機我剛剛有要到那個承辦人的分機	喔我這邊有分機我剛剛有要到那個承辦人的分機	喔我這邊有分機我剛剛有要代辦人的分機先有分機我剛剛有要到那個承辦人的分機			
9285	821195001546001	6	承辦人分機喔	承辦人分機喔	承辦人喔			
9286	821195001546001	7	啊那這個您可能要向那個承辦人員那邊去做個確認	啊那這個您可能要向那個承辦人員那邊去做個確認	啊那這個您可能的承辦人員那邊去驗證			
9287	821195001546001	8	對對對因為我剛打電話去長官那邊是說他們有公佈	對對對因為我剛打電話去長官那邊是說他們有公佈	對對對因為我剛打電話去繳顯示說他們			
9288	821195001546001	9	唉麻煩電話	唉麻煩電話	唉麻煩			
9289	821195001546001	10	好那零五	好那零五	好零五			
9290	821195001546001	11	然後二七八	然後二七八	然後唉齁二七八			
9291	821195001546001	12	然後二八六一	然後二八六一	然後二八六一二八六一			
9292	821195001546001	13	二七八二八六一	二七八二八六一	二七二八六一			
9293	821195001546001	14	然後您幫我轉那個三六六二的一位林先生	然後您幫我轉那個三六六二的一位林先生	然後您幫我轉那個三六六一位林先生			
9294	821195001546001	15	等一下喔	等一下喔	喔			
9295	821195001546001	16	我拿我拿一下紙筆	我拿我拿一下紙筆	我拿我拿我拿一下七B			
9296	821195001546001	17	然後七八	然後七八	楊			
9297	821195001546001	18	對然後二八六一	對然後二八六一	對然後唉			
9298	821195001546001	19	二八六一	二八六一	嗯			
9299	821195001546001	20	對那您幫我轉三六六二的林先生	對那您幫我轉三六六二的林先生	對那我轉三六六二的林先生			
9300	821195001546001	21	三六六二林先生	三六六二林先生	三六六二林先生二六六二林先生			
9301	821195001546001	22	喔好謝謝你喔	喔好謝謝你喔	好謝謝你喔			
9302	821195001546001	23	麻煩您了	麻煩您了	麻煩您了			
9303	821195001546001	24	好好謝謝	好好謝謝	好好謝謝			
9304	821195001546001	25	byebye	byebye	byebyebyebye			
9305	821195001546002	1	台北市區監理所您好敝姓詹很高興為您服務	台北市區監理所您好敝姓詹很高興為您服務	台北市區監理所您好敝姓詹很喂			
9306	821195001546002	2	幫我轉一下政風室嗎任何一位都可以	幫我轉一下政風室嗎任何一位都可以	幫我轉一下政風室嗎任何一位都可以			
9307	821195001546002	3	先請教怎麼稱呼小姐您	先請教怎麼稱呼小姐您	先請稱呼			
9308	821195001546002	4	我姓林雙木林	我姓林雙木林	我姓林雙木林			
9309	821195001546002	5	嗯可是我剛才按零唉	嗯可是我剛才按領牌	嗯可是我剛才唉剛才按領牌			
9310	821195001546002	6	呃您按九	呃您按九	好那你喔			
9311	821195001546002	7	對九是話務中心那零才是總機喔	對就是話務中心那零才是總機喔	是話務中心那是鍾			
9312	821195001546002	8	喔對不起對不起那我再改撥	喔對不起對不起那我再改撥	喔對不起對不起那我再改撥對不起那我再改撥對不起對不起那我再改撥對不起對不起那我再改撥			
9313	821195001546002	9	不會謝謝再見	不會謝謝再見	謝謝再見			
9314	821195001546085	1	先生您好	先生您好	先生您好			
9315	821195001546085	2	這個部分不行捏一定要他們補發我幫您確認一下稍等	這個部分不行捏一定要他們補發我幫您確認一下稍等	證明也一定要他們補發我幫您一下稍等			
9316	821195001546085	3	OK	OK	喔			
9317	821195001546004	1	台北市區監理所您好	台北市區監理所您好	對您好			
9318	821195001546004	2	小姐妳好吼	小姐你好吼	小姐你好吼唉你好吼			
9319	821195001546004	3	請問一下我那個機車燃料稅牌照稅過期了還可以繳嗎	請問一下我那個機車燃料稅牌照稅過期了還可以繳嗎	請問一下我那個機車燃料牌照稅過期了繳嗎			
9320	821195001546004	4	是燃料還是牌照	是燃料還是拍照	是廖還是拍照			
9321	821195001546004	5	牌照吧四百五是	拍照吧四百五十	二五七			
9322	821195001546004	6	四百五是燃料稅啦	四百五十燃料稅啦	十八歲啦			
9323	821195001546004	7	他還可以繳你有單子吼	他還可以繳您有單子吼	他還可以繳您有單子			
9324	821195001546004	8	唉對我有單子有單子可以到銀行	唉對我有單子有單子可以到銀行	單子有單子到銀行			
9325	821195001546004	9	七月底就過期了seven	七月底就過期了seven	七月底就過期了seven地址有過期了seven一就過期了seven地址有過期了seven			
9326	821195001546004	10	沒關係seven不行啦銀行富邦啦華南那種都可以	沒關係seven不行啦銀行富邦啦華南那種都可以	沒關係一四二份是不是富邦啦華南那種都可以			
9327	821195001546004	11	銀行就可以是吧嘿對對吼還可以收吼	銀行就可以是吧嘿對對吼還可以收吼	銀行就可以把可以對對吼還可以收			
9328	821195001546004	12	好byebye	好byebye	好byebye			
9329	821195001546004	13	好bye	好byebye	好			
9330	821195001546005	1	公路總局用路人服務中心您好敝姓詹很高興為您服務	公路總局用路人服務中心您好敝姓詹很高興為您服務	公路總局用路人服務中心您好敝姓詹很高興為你服務			
9331	821195001546005	2	客運中心動態	客運中心動態	客運中心動態中心動態			
9332	821195001546005	3	對動態資訊中心的電話可以給我嗎那邊有嗎	對動態資訊中心的電話可以給我嗎那邊有嗎	對動態資訊電話可以給我嗎那邊有嗎			
9333	821195001546005	4	呃我這邊沒有先請教怎麼稱呼先生	呃我這邊沒有先請教怎麼稱呼先生	呃我這邊請教怎麼稱呼先生			
9334	821195001546005	5	他是監理服務網嗎	他是監理服務網嗎	他是講嗎			
9335	821195001546005	6	所以他是taiwanbus	所以他是台灣對	所以你們對			
9336	821195001546005	7	唉taiwanbus沒錯	唉他英文的是沒錯	唉他詢問的是沒錯			
9337	821195001546005	8	等一下喔呃這個部分因為不是我們的您稍等一下喔	等一下喔呃這個部分因為不是我們的您稍等一下喔	等一下喔呃這個部分因為不是我們的您是喔			
9338	821195001546005	9	你那邊有那個電話嗎因為我他的電話對	您那邊有那個電話嗎因為我他的電話對	您那邊有那個點因為我他的電話對			
9339	821195001546005	10	對可能要問一下監理站	對可能要問一下監理站	對可能要問一下你站			
9340	821195001546005	11	所以要幫要自己再打到監理站還是那邊可以幫我轉	所以要幫要自己再打到監理站還是那邊可以幫我轉	是幫叫資金到期還是那邊可以幫我轉			
9341	821195001546005	12	呃我這邊沒辦法轉接請您稍等一下	呃我這邊沒辦法轉接請您稍等一下	嗯沒辦法轉接請您稍等一下			
9342	821195001546006	1	公路總局用路人服務中心您好敝姓陳很高興為您服務	公路總局用路人服務中心您好敝姓陳很高興為您服務	公路總局用路人服務中心您好敝姓陳很高興為您服務總局用路人服務中心您好敝姓陳很高興為您服務嗯局用路人服務中心您好敝姓陳很高興為您服務總局用路人服務中心您好敝姓陳很高興為您服務			
9343	821195001546006	2	喔監理所吼吼	喔監理所吼吼	喔監理所好			
9344	821195001546006	3	唉這邊是公路總局用路人服務中心	唉這邊是公路總局用路人服務中心	唉這邊是公路總局用戶中心			
9345	821195001546006	4	這邊不是監理所嗎	這邊不是監理所嗎	這不是監理所嗎			
9346	821195001546006	5	唉您是想要詢問什麼樣的問題嗎	唉您是想要詢問什麼樣的問題嗎	唉您是想要詢問什麼樣的我想要詢問什麼樣的問題嗎			
9347	821195001546006	6	我請問的是我們那個機車行照是不要換嘛對不對	我請問的是我們那個機車行照是不要換嘛對不對	我請問的是我們那個機車是不要換嘛對不對			
9348	821195001546006	7	啊啊駕照駕照要換嘛	呃駕照駕照要換嘛	喔駕照要換嘛			
9349	821195001546006	8	嘿好先請教您貴姓怎麼稱呼您	嘿好先請教您貴姓怎麼稱呼您	嘿好先請教您貴姓怎麼			
9350	821195001546006	9	呃我我我姓江	呃我我我姓江	呃我我我姓郭			
9351	821195001546006	10	是江先生您好也不用到七十五歲的時候再換	是江先生您好也不用到七十五歲的時候再換	也不用到七十五歲的時候再換			
9352	821195001546006	11	喔現在是我一百零七年到期沒有我昨昨天晚上看到啦吼	喔我現在是我一百零七年到期沒有我昨昨天晚上看到然後	喔我現在是我一百零七年到期沒有我這樣看到然後帶是我一百零七年到期沒有我昨昨天晚上看到然後			
9353	821195001546006	12	嘿沒關係	嘿沒關係	嘿沒關			
9354	821195001546006	13	那那到那不要不要更換掉我們要怎樣都不要更換	那拿到那不要不要更換掉我們要怎樣都不要更換	那拿到那不要不要更換就怎樣都更換			
9355	821195001546006	14	到七十五歲的時候再換照就可以了	到七十五歲的時候再換照就可以了	到期所以的時候再換照就可以了			
9356	821195001546006	15	吼那謝謝你啊	好那謝謝你啊	好那謝謝你喔			
9357	821195001546006	16	嘿不會麻煩您了	嘿不會麻煩您了	嘿不會麻煩了			
9358	821195001544780	1	就是目前花蓮我們這邊的話就是就是有五個施工點	就是目前花蓮我們這邊的話就是就是有五個施工點	就是目前花蓮我這邊的話就是就是有五個施工點			
9359	821195001544780	2	啊他們他們這種管制都是雙向雙向是可以通的還是只有單向是通的	啊他們他們這種管制都是雙向雙向是可以通的還是只有單向是通的	啊他們他們這種管制雙向雙可以通的還是只有單向是通的			
9360	821195001544780	3	他目前就是說他管制的時候就是單向通車	他目前就是說他管制的時候就是單向通車	他目前就是說他管制吼就是單向通車			
9361	821195001544780	4	單向通車而已	單向通車而已	單向通車而已			
9362	821195001544780	5	嘖喔好好	是喔好好	好好			
9363	821195001544780	6	好麻煩您好感謝您的來電再見	好麻煩您好感謝您的來電再見	好麻煩您好感C的來電再見			
9364	821195001444110	1	公路總局用路人服務中心您好敝姓詹很高興為您服務	公路總局用路人服務中心您好敝姓詹很高興為您服務	公路總局用路人中心您好敝姓詹很高興為您服務			
9365	821195001444110	2	唉喂你好	唉喂你好	唉喂你好喂你好			
9366	821195001444110	3	不好意思我這兩天有收到一張那個就是臨時驗車通知單啊	不好意思我這兩天有收到一張那個就是臨時驗車通知單啦	我這兩天有收到一張那個就是通知單啊			
9367	821195001444110	4	嘿啊我想問一下那個驗車的部分你們是六日可以驗嗎	嘿啊我想問一下那個驗車的部分你們是六日可以驗嗎	嘿啊我那個驗車的十六年嗎			
9368	821195001444110	5	是先請教怎麼稱呼先生呢	是先請教怎麼稱呼先生呢	是先請教先生了			
9369	821195001444110	6	呃黃先生嘿	呃黃先生嘿	呃鄭嘿			
9370	821195001444110	7	呃你們只有一到五而已是不是	呃你們只有一到五而已是不是	呃你們只有一是不是			
9371	821195001444110	8	呃週一到週五是的	呃週一到週五是的	呃週一到週五是的一到週五是的			
9372	821195001444110	9	嘿啊那是幾點到幾點	可以啊那是幾點到幾點	可以啊是幾點到幾點			
9373	821195001444110	10	請問一下您是要在哪個監理站驗車	請問一下您是要在那個監理站驗車	請問一下您是要在那個監理站驗車問一下您是要在那個監理站驗車等一下您是要在那個監理站驗車問一下您是要在那個監理站驗車一下您是要在那個監理站驗車問一下您是要在那個監理站驗車等一下您是要在那個監理站驗車問一下您是要在那個監理站驗車			
9374	821195001444110	11	您是摩托車嗎	您是摩托車嗎	您是摩托車嗎			
9375	821195001444110	12	唉對摩托車	唉對摩托車	對			
9376	821195001444110	13	呃摩托車的話其實每個監理站都可以	呃摩托車的話其實每個監理站都可以	呃摩托的話其實每個監理站都可以			
9377	821195001444110	14	那比較接近新莊的話是哪一個呢	那比較接近新莊的話是哪一個呢	那比較接近新莊的話一個呢			
9378	821195001444110	15	板橋或蘆洲	板橋或蘆洲	板橋或蘆洲			
9379	821195001444110	16	喔板橋或蘆洲是不是	喔板橋或蘆洲是不是	喔板橋或蘆洲是			
9380	821195001444110	17	喔只要擇一單位去驗車就好了	喔我只要擇一單位去驗車就好了	喔我只要擇一單位去驗車好了			
9381	821195001444110	18	對只要回到監理單位其實都可以為您做一個驗車這樣子	對只要回到監理單位其實都可以為您做一個驗車這樣子	對只要回到監理其實都可以為您做一個驗車只			
9382	821195001444110	19	謝謝不好意思喔	謝謝不好意思喔	謝謝不不好意思喔			
9383	821195001444110	20	好不會再見	好不會再見	好不會			
