no	file name	file number	answer	result_1(0%)	result_2(random)	replace	insert	delete
6177	821195001544425	1	呃先生您好我這邊幫你查詢呃請問一下您是在哪一個站點搭乘	呃先生您好我這邊幫您查詢呃請問一下您是在哪一個站點搭乘	呃先生您的地址查詢呃請問一下您是站點搭乘			
6178	821195001544425	2	呃我這邊查我這邊查	呃我這邊查我這邊查啊	嗯查我這邊			
6179	821195001544425	3	喔了解我這邊查詢嗎	喔了解我這邊查詢嗎	喔了解我這邊查詢了解我這邊查詢嗎			
6180	821195001544425	4	有我這邊查詢他現在已經要到這個蘇澳港這邊了	有我這邊查詢他現在已經要到這個蘇澳港這邊了	有我這邊查詢那已經要到這個蘇澳港這邊了			
6181	821195001544425	5	喔好那嗯沒有因為我網路上沒有看到嗯喔瞭解呃沒有是車	喔好那嗯沒有因為我網路上沒有看到嗯好了解呃沒有行車	喔好那唉因為我往帳單吼了解呃沒有汽車			
6182	821195001544425	6	嗯你是使用的是這個Ibus嗎	呃您是使用的是這個唉可是嗎	是使用的攜帶的是嗎			
6183	821195001544425	7	對對對對	對對對對	對對對對			
6184	821195001544425	8	喔了解我這邊幫您查詢已經要到站了囉這邊是有寫這樣子	喔了解我這邊幫您查詢已經要到站了如果這邊是有寫這樣子	喔了解我這邊幫您查詢站了如果這邊是有寫這樣子			
6185	821195001544425	9	好不好意思喔再麻煩了	好不好意思吼再麻煩了	好不好意思吼再麻煩了			
6186	821195001544192	1	公路總局用路人服務中心您好敝姓顏很高興為您服務	公路總局用路人服務中心您好敝姓顏很高興為您服務	公路總局用路人服務中心您好敝姓顏很高興為您服務			
6187	821195001544192	2	喂小姐你好	喂小姐你好	喂想您好			
6188	821195001544192	3	呃電動腳踏車還是摩托車	呃電動腳踏車還是摩托車	呃電動腳踏車還是摩托車			
6189	821195001544192	4	電動腳踏車	電動腳踏車	電動車嗯轎車			
6190	821195001544192	5	是請問小姐貴姓怎麼稱呼您	是請問小姐貴姓怎麼稱呼您	小姐貴姓怎麼稱呼您			
6191	821195001544192	6	謝小姐您好那麻煩您稍等我詢問一下我們的承辦人員	是小姐您好那麻煩您稍等我詢問一下我們的承辦人員	小姐您好那麻煩您稍等我詢問一下人的承辦人員			
6192	821195001544192	7	不會您稍等喔	不會您稍等喔	不會			
6193	821195001512650	1	台北市區監理所您好敝姓黃很高興為您服務	台北市區監理所您好敝姓黃很高興為您服務	台北市區監理所您好敝姓黃很高興服務			
6194	821195001512650	2	唉黃小姐您好我請教一下吼	唉黃小姐您好我請教一下吼	唉黃小姐您只要一下吼			
6195	821195001512650	3	先生貴姓怎麼稱呼您	先生貴姓怎麼稱呼您	先貴姓怎麼稱呼您			
6196	821195001512650	4	許先生您好喔我先請問一下您是一般自用的駕照嗎普通駕駛	徐先生您好喔我先請問一下您是一般自用的駕照嗎普通駕駛	徐先生您喔我先請問一下您是一般自用的駕照嗎普通駕駛			
6197	821195001512650	5	對對自用的	對對自用的	對			
6198	821195001512650	6	那許先生普通駕照可以用到七十五歲一百零二年開始不用更換了	那許先生普通駕照可以用到七十五歲一百零二年開始不用更換了	那許先生普通的E用到七十五歲一百零二年開始不用更換了			
6199	821195001512650	7	啊七十五歲後會換換發那會寄送高齡換照的通知單給您您再去換	啊七十五歲後會換換發那會寄送高齡換照的通知單給您您再去換	啊七十五歲後會換換發那會寄送高齡換照的通知單給您您再去			
6200	821195001512650	8	啊所以我們只要再去辦就可以了是嗎	啊所以我們只要再去辦就可以了是嗎	啊所以我們只要按就可以了是			
6201	821195001512650	9	那我這個他有舊的駕照是一百零七年到期那我需要再去換駕照嗎	那我這個他有舊的駕照是一百零七年到期那我需要再去換駕照嗎	那我這個的駕照是一百零七年到期要再去換駕照嗎			
6202	821195001512650	10	喔不用可以用到七十五歲	喔不用可以用到七十五歲	喔所以一七五三一			
6203	821195001512650	11	喔直接用那一張就可以用是嗎	喔我直接用那一張就可以用是嗎	喔直接用那一張就嗎			
6204	821195001512650	12	好好謝謝	好好謝謝	是			
6205	821195001512650	13	請問許先生需要其他服務嗎	請問許先生需要其他服務嗎	請問許先生需要其他嗎			
6206	821195001512651	1	就是您假設您是要幫他辦理的	就是您假設您是要幫他辦理的	假設您是要			
6207	821195001512651	2	就是您的身份證跟印章	就是您的身份證跟印章	就是您等跟印章就身份證跟印章			
6208	821195001512651	3	這樣就可以了嗎	這樣就可以了嗎	嗯就可以了嗎			
6209	821195001512651	4	然後跟他的車牌	然後跟他的車牌	然後跟太太			
6210	821195001512651	5	然後車子的	然後車子的	然後車子的			
6211	821195001512651	6	對對對也要印章喔	對對對也要印章喔	對對對也要			
6212	821195001512651	7	對因為要蓋印章簽章就是要簽名加蓋章	對因為要蓋印章簽章就是要簽名加蓋章	對因為要蓋印章先就是要簽名			
6213	821195001512651	8	喔車牌還有	喔我車牌還有	喔車牌還			
6214	821195001512651	9	嗯然後就是這樣子就可以了	嗯然後就是這樣子就可以了	吼就是這樣直接			
6215	821195001512651	10	那對方證件都不用帶了	那對方證件都不用帶了	那這邊都不用帶了			
6216	821195001512651	11	呃對對方的資料就不用帶了	呃對對方的資料就不用帶了	對方的資料就不用帶了			
6217	821195001512651	12	那如果有什麼欠稅也要交嘛對不對	那如果有什麼欠稅也要繳嘛對不對	那如果有什麼欠稅也要對			
6218	821195001512651	13	對罰單啊欠費欠款都要現場繳納	對罰單上的欠費欠款都要現場繳納	對罰單啦欠費欠			
6219	821195001512651	14	那如果呃行照唉唉行照也不用帶嘛對不對	那如果呃行照唉唉行照也不用帶嘛對不對	我呃行照行照也不用帶嘛對不對			
6220	821195001512651	15	呃如果他行照沒有就是說遺失還在的話您可以帶過去	呃如果他行照沒有就是說遺失還在的話您可以帶過去	行照沒有就是說遺失還在的話您可以帶過去我他是要沒有就是說遺失還在的話您可以帶過去			
6221	821195001512651	16	您再說一次	您再說一次是	零三			
6222	821195001512651	17	啊如果沒有	啊如果沒有	三六			
6223	821195001512651	18	如果沒有的話就只要車牌就可以	如果沒有的話就只要車牌就可以	我沒有的話就只要車牌就可以			
6224	821195001512651	19	呃對沒有錯麻煩您了	呃對沒有錯麻煩您了	呃對沒有錯麻煩您			
6225	821195001512651	20	好了解好好喔喔	好了解好好喔喔	好了解好			
6226	821195001512652	1	台北市監理所您好敝姓吳很高興為您服務	台北市監理所您好敝姓吳很高興為您服務	台北市區監理您好敝姓吳			
6227	821195001512652	2	幫我接那個盧盧小姐	幫我接那個盧盧小姐	幫我接那個路呢			
6228	821195001512652	3	呃對不起我先請教您貴姓	呃對不起我先請教您貴姓	呃對不起我姓江			
6229	821195001512652	4	我姓陳陳小姐	我姓陳陳小姐	我姓陳陳小姐			
6230	821195001512652	5	二零一二零二啊	二零一二零二啊	二零一			
6231	821195001512652	6	二零一或二零二嗎對對對啊您是有駕照方面的問題	二零一或二零二嗎對對對啊您是有駕照方面的問題	二零一或二零二嗎對就是有駕照方面的			
6232	821195001512652	7	對對對對對	對對對對對	對對對對對			
6233	821195001512652	8	好您您等一下喔不好意思	好您您等一下喔不好意思	等一下喔我意思			
6234	821195001512611	1	公路總局用路人服務中心敝姓常很高興為您服務	公路總局用路人服務中心敝姓常很高興為您服務	公路總局用路人服務中心敝姓常很高興為您服務			
6235	821195001512611	2	呃你好你這邊是那個監理處嘛吼	呃你好你這邊是那個監理處嘛吼	呃您好您這邊是監理處嘛吼			
6236	821195001512611	3	對台北區監理所	對台北區監理所	對北區監理所			
6237	821195001512611	4	對我我問一下喔呃有一有一個案件比較特殊吼呃	對我我問一下喔呃有一有一個案件比較特殊吼呃	對我我問一下喔呃有一案件比較特殊吼呃我我問一下喔呃有一有一個案件比較特殊吼呃			
6238	821195001512611	5	是這樣我家人在去年的話吼因為在高速公路上蛇行啊超速啊吼	是這樣我家人在去年的話吼因為在高速公路上蛇行啊超速然後	是在去年的話吼因為在高速公路蛇行啊超速然後			
6239	821195001512611	6	吃了一張那個呃公共危險的罰單	是了一張那個呃公共危險的罰單	是了一張那個呃危險的罰單			
6240	821195001512611	7	啊罰單也去也就當時就儘快去繳錢把他清掉了	唉罰單也去也就當時就儘快去繳錢把他清掉了	去年就儘快去繳錢把他清掉了			
6241	821195001512611	8	那後來就事情被移送到地檢署	然後來就事情被移送到地檢署	然後有事情被移送到地檢署			
6242	821195001512611	9	六都的話都是在交通裁決所那非六都的話才會是在監理站	六都的話都是在交通裁決所那非六都的話才會是在監理站	六都的話都是在交通裁決所那非六都的話才會是在監理站			
6243	821195001512611	10	喔這樣子	喔這樣子	喔我這樣			
6244	821195001512611	11	但是如果是你是新竹的話那就是新竹監理站那邊的問題這樣子	但是如果是您是新竹的話那就是新竹監理站那邊的問題這樣子	但是如果是您是先把那就是新竹監理站那邊的問題這樣子			
6245	821195001512611	12	管轄範圍嘿	管轄範圍嘿	關係			
6246	821195001512611	13	喔這樣子吼	喔這樣子吼	喔這樣子吼喔			
6247	821195001512611	14	好那我那	好那我那	好那我那			
6248	821195001512611	15	我知道了二三六五八二七零嘛	我知道了二三六五八二七零嗎	我知道了二三六五八二			
6249	821195001512611	16	好好那我知道	好好那我知道	是到			
6250	821195001512611	17	再麻煩您喔好感謝您了	再麻煩您喔好感謝您了	再麻煩您喔好感謝您			
6251	821195001512653	1	台北市區監理所您好敝姓吳很高興為您服務	台北市區監理所您好敝姓吳很高興為您服務	台北市區我您好敝姓吳很高興為您服務			
6252	821195001512653	2	嗯吳小姐你好	嗯吳小姐你好	呃是			
6253	821195001512653	3	呃我想要麻煩你那我的車子昨天在街上被一輛摩托車擦撞	呃我想要麻煩您那我的車子昨天在街上被一輛摩托車擦撞	呃我想要麻煩您那我的車子昨天在街上被我車子他重要麻煩您那我的車子昨天在街上被一輛摩托車擦撞			
6254	821195001512653	4	是車主他已經跑掉了	是車主他已經跑掉了	是五他已經跑掉了			
6255	821195001512653	5	是您貴姓怎麼稱呼	是您貴姓怎麼稱呼	是您貴姓怎麼稱呼			
6256	821195001512653	6	呃我姓我也姓吳	呃我姓我也姓胡	唉我也姓吳			
6257	821195001512653	7	然後我有記下他的車牌號碼	然後我有記下他的車牌號碼	然後我有他的車牌號碼			
6258	821195001512653	8	所以他是肇事您想詢問肇事逃逸嗎	所以他是肇事您想詢問肇事逃逸嗎	所以他是肇事您小時逃逸嗎			
6259	821195001512653	9	呃我想請問一下所以這個車主他的資料	呃我想請問一下所以這個車主他的資料	呃我請問一下所以這個車主他的資料			
6260	821195001512653	10	呃是這邊先跟吳小姐說明如果說他是摩托車對	呃是這邊先跟吳小姐說明如果說他是摩托車對	呃是這邊先跟吳小姐說明如果說他是摩托			
6261	821195001512653	11	蛤你們監理站不是有他的車車籍資料嗎	好你們監理站不是有他的車車籍資料嗎	好監理站不是有他的車車籍資料嗎			
6262	821195001512653	12	對您要報案向警方請警方協協助您	對您要報案向警方請警方協協助您	對您要放行警方協協助您			
6263	821195001512653	13	喔一定要透過警察喔	喔一定要透過警察喔	喔所以過警察喔要透過警察喔			
6264	821195001512653	14	是沒錯一定要通過警察我們這邊沒有辦法告訴您任何車主的資料	是沒錯一定要通過警察我們這邊沒有辦法告訴您任何車主的資料	是沒錯一定要通過警察我們只有辦法告訴您任何車主的要			
6265	821195001512653	15	喔是這樣喔	喔我姓這樣喔	喔			
6266	821195001512653	16	那那個監理站不是他你們是總括汽車跟摩托車的所有的業務	那那個監理站不是他您們是中過汽車跟摩托車的所有的業務	那那個監理不是他您們是中過汽車跟摩托車的是五那個監理站不是他您們是中過汽車跟摩托車的所有的業務			
6267	821195001512653	17	蛤但是我沒有拍照捏我只有記下他的號碼而已耶	好但是我沒有拍照捏我只有記下他的號碼而已耶	好但是我沒有捏我記一下他的號碼而已耶			
6268	821195001512653	18	呃沒關係您還是向警方報案警方會受理肇事逃逸	呃沒關係您還是向警方報案警方會受理肇事逃逸	呃沒關係您還是向警方報案警方會受理逃逸			
6269	821195001512653	19	喔好那我知道	喔好那我知道	喔好那我知道喔好那我知道喔那我知道喔好那我知道			
6270	821195001512653	20	是那再麻煩您	是那再麻煩您	是那再麻煩您			
6271	821195001512653	21	OKbyebye	OKbyebye	OKbye			
6272	821195001512653	22	是感謝您的來電再見	是感謝您的來電再見	感謝您的來電再見的來電再見			
6273	821195001512612	1	公路總局運營服務中心您好敝姓陳很高興為您服務	公路總局運營服務中心您好敝姓陳很高興為您服務	公路總局運營服務中心您好敝姓陳很高興您服務			
6274	821195001512612	2	小姐你好	小姐你好	是要一號			
6275	821195001512612	3	請問請問一下我那個燃料稅啊	請問請問一下我那個燃料稅啊	請問一下我那個燃料稅啊			
6276	821195001512612	4	先請教您貴姓怎麼稱呼	先請教您貴姓怎麼稱呼	先請教您貴姓怎麼			
6277	821195001512612	5	呃我姓蔡	呃我姓蔡	呃我姓我姓蔡			
6278	821195001512612	6	蔡先生您好可以喔一樣是線上可以去做繳納喔	蔡先生您好可以喔一樣是線上可以去做繳納喔	蔡先生您好可以喔我一樣是線上可以去下喔			
6279	821195001512612	7	可以做繳納可以	可以做繳納可以	繳納的			
6280	821195001512612	8	我幫您查詢請問車號是多少	我幫您查詢請問車號是多少	幫您查詢請問車號			
6281	821195001512612	9	呃ANW	呃AMW	嗯駕照一路			
6282	821195001512612	10	AMW還是AN	AMW還是AM	AMGZM			
6283	821195001512612	11	NN	嗯嗯	喔			
6284	821195001512612	12	ANW一二七零	AMW一二七零	AW一二七零			
6285	821195001512612	13	一二七零好稍等喔謝謝	一二七零好稍等喔謝謝	一二七零好稍等			
6286	821195001512612	14	請問車主大名	請問車主大名	七大名			
6287	821195001512612	15	呃蔡興義	呃蔡興義	呃蔡興義			
6288	821195001512612	16	蔡先生本人嗎	蔡先生本人嗎	蔡先生本人			
6289	821195001512612	17	您已經繳囉在七月十一號網絡繳費的	您已經繳囉在七月十一號網絡繳費的	您已經在七月十一號網絡繳費			
6290	821195001512612	18	七月十一號網絡繳費	七月十一號網絡繳費	七月			
6291	821195001512612	19	已經繳OK好那那我知道	已經繳OK好那那我知道	已經繳OK好那那我本			
6292	821195001512612	20	好的謝謝您	好的謝謝您	好小姐您			
6293	821195001512612	21	好謝謝你好byebye	好謝謝你好byebye	嗯好不會bye			
6294	821195001512654	1	公路總局用服中心您好敝姓陳很高興為您服務	公路總局用服中心您好敝姓陳很高興為您服務	公路總局用服中心您好敝姓陳很高興為您			
6295	821195001512654	2	喂您好我想是請問一下有關駕照的部分是不是跟您們做詢問	喂您好我想是請問一下有關駕照的部分是不是跟您們做詢問	請問一下有關駕照的部分是跟您們做詢問			
6296	821195001512654	3	可以先請教您貴姓怎麼稱呼	可以先請教您貴姓怎麼稱呼	可以先請教您貴姓怎麼稱呼			
6297	821195001512654	4	呃我姓黃吼	呃我姓黃吼	呃我			
6298	821195001512654	5	黃先生是	黃先生是	黃先生			
6299	821195001512654	6	我這邊先請教一下假設說我去考大型重型機車	我這邊先請教一下假設說我去考大型重型機車	我這邊先請教一下假設說我去考打一			
6300	821195001512654	7	我的我我的這張駕照是不是等同於自小客車可以使用	我的我我的這張駕照是不是等同於自小客車可以使用	我的我我的要是不是等同於自小客車可以使用			
6301	821195001512654	8	大型重機就歸大型重機而已	大型重機就歸大型重機而已	大型重機就歸大型			
6302	821195001512654	9	沒有不可能啊汽車跟機車是分開的	沒有不可能他是汽車跟機車是分開的	沒有不可能他是汽車跟機車是分開的			
6303	821195001512654	10	汽車跟機車是分開的	汽車跟機車是分開的	機車是分開的			
6304	821195001512654	11	所以他的大型重機機車他的	所以他的大型重機機車他的	所以他的大型重機車他的			
6305	821195001512654	12	機車會變成大型重機但是汽車還是歸汽車不可能收走	機車會變成大型重機但是汽車還是歸汽車不可能收走	機車會變成大型重機但是汽車汽車不可能收走			
6306	821195001512654	13	這個要問軍警耶	這個要問軍警耶	這個要問軍警			
6307	821195001512654	14	喔喔喔喔喔	喔喔喔喔喔	喔喔喔喔喔			
6308	821195001512654	15	對這我我我們不會把他們的駕照回收	對這我我我們不會罰他們的駕照回收	對這我我我們他們的駕照使用			
6309	821195001512654	16	嗯哼哼哼哼哼	嗯哼哼哼哼哼	嗯哼哼哼哼哼哼哼			
6310	821195001512654	17	對就是汽車跟機車是分開的	對就是汽車跟機車是分開的	對只汽車跟開的			
6311	821195001512654	18	嗯哼哼哼哼是好了解這樣	嗯哼哼哼哼是好了解這樣	嗯哼哼哼哼是好廖			
6312	821195001512654	19	這我就不清楚了	這個我就不清楚啦	這個我就不啦			
6313	821195001512654	20	好好好是這樣我知道了	好好好是這樣我知道了	好是這樣我知道			
6314	821195001512654	21	那再麻煩了	那再麻煩了	那再麻煩			
6315	821195001512654	22	好謝謝您謝謝byebye	好謝謝您謝謝byebye	好謝謝您謝謝byebye			
6316	821195001512613	1	公路總局用路人服務中心您好敝姓陳很高興為您服務	公路總局用路人服務中心您好敝姓陳很高興為您服務	公路總局用路人服務中心陳很高興為您服務			
6317	821195001512613	2	唉唉小姐不好意思喔	唉唉小姐不好意思喔	唉唉小姐不好意思喔直接不好意思喔			
6318	821195001512613	3	是燃料費嘛對呃先請教小姐貴姓怎麼稱呼	是燃料費嗎對呃先請教小姐貴姓怎麼稱呼	對嘛對呃先請教您怎麼稱呼			
6319	821195001512613	4	是康小姐您好嘿您手邊有單子嗎	是康小姐您好可以您手邊有單子嗎	是康零您手邊有單子嗎			
6320	821195001512613	5	唉沒有沒帶到	唉沒有沒帶到	嘿帶到沒有			
6321	821195001512613	6	沒有單子嗎那沒關係你可以幫我就是去超商	沒有單子嗎那沒關係你可以幫我就是去超商	沒有單子沒你可以我就是去超商			
6322	821195001512613	7	使用超商的多媒體機	使用超商的多媒體機	使用超商T			
6323	821195001512613	8	喔超商可以繳	喔我超商可以繳	繳			
6324	821195001512613	9	對對對輸入車主的身份證跟車牌就可以補繳了對對對	對對對輸入車主的身份證跟車牌就可以補繳了對對對	對對對車主的身份證跟車牌可以了對對對			
6325	821195001512613	10	還有會有違罰金的問題嗎	還有會有違罰金的問題嗎	還有會有違罰金嗎			
6326	821195001512613	11	現在還還暫時還沒有產生喔麻煩您要儘快繳	現在還還暫時還沒有產生喔麻煩您要儘快繳	現在還還在還沒有產生喔麻煩您要儘快繳			
6327	821195001512613	12	好所以商超商可以繳付是對	好所以商超商可以繳付是對	好所以商超商可以對			
6328	821195001512613	13	好那我知道了	好那我知道了	好那我知那我知道了			
6329	821195001512613	14	麻煩您囉	麻煩您囉	麻煩您囉嗯囉			
6330	821195001512613	15	byebye	byebye	對			
6331	821195001512613	16	謝謝您的來電謝謝再見	謝謝您的來電謝謝再見	謝謝的來電謝謝再見			
6332	821195001512380	1	公路總局用路人服務中心您好敝姓吳很高興為您服務	公路總局用路人服務中心您好敝姓吳很高興為您服務	公路總局用路人服務中心您好敝姓吳很高興為您服務			
6333	821195001512380	2	是請問您貴姓怎麼稱呼	是請問您貴姓怎麼稱呼	嗯貴姓怎麼稱呼			
6334	821195001512380	3	我姓張我問一是張先生您好您想詢問監理站什麼業務	我姓張我問一是張先生您好您想詢問監理站什麼業務	我姓張我問一是張先生您好您想詢問什麼業務			
6335	821195001512380	4	呃那個車子要停用啦	呃那個車子要停用啦	是要停用啦			
6336	821195001512380	5	您車子要停用	您車子要停用	您車子要停用			
6337	821195001512380	6	停用那那台那個	停用那那台那個	永和			
6338	821195001512380	7	要帶什麼文件嗎	要帶什麼文件嗎	要帶什麼文件嗎			
6339	821195001512380	8	是是要什麼文件去辦理	是是要什麼文件去辦理	是是要什麼文件去辦理			
6340	821195001512380	9	好您線上稍等立即為您確認您是機車還汽車	好您線上稍等立即為您確認您是機車還汽車	好您線上稍等立即人您是機車還汽車您線上稍等立即為您確認您是機車還汽車			
6341	821195001512380	10	是小貨車	是小貨車	是蕭			
6342	821195001512380	11	有快要到定檢日了嗎	有快要到定檢日了嗎	有快要到定檢日了嗎			
6343	821195001512380	12	唉大概是過了啦	唉大概是過了嗎	唉過來			
6344	821195001512380	13	呃您方便提供車號幫您做查詢	呃您方便提供車號幫您做查詢	呃您方便提供車號幫您做查詢			
6345	821195001512380	14	車牌號碼掐白喝滅系哇接	車牌號碼掐白盒滅系哇接	查一下白盒滅系哇接			
6346	821195001512380	15	掐白喝罵唉哇跨邁吼唉TS	下白喝罵唉哇跨邁吼唉TS	下載完跨邁吼唉			
6347	821195001512380	16	TS	RTS	RTSBS			
6348	821195001512380	17	三一八零	三一八零	三一三一八零一八零一八零			
6349	821195001512380	18	登記大名	登記大名	登記大名登記大名您登記的大名			
6350	821195001512380	19	呃張先生我重複一下車牌跟您確認哦台灣的T嗎	呃張先生我重複一下車牌跟您確認吼台灣的T嗎	呃張先生我重複一下車牌跟您確認吼台灣的T嗎先生我重複一下車牌跟您確認吼台灣的T嗎			
6351	821195001512380	20	台灣的T然後S三	台灣的T然後S三	宜蘭			
6352	821195001512380	21	是是啊TS啊	是是RTS好	好			
6353	821195001512380	22	然後dash三一八零嗎	然後帶是三一八零嗎	然後帶是三一八零嗎			
6354	821195001512380	23	還是您有身份證字號幫您做查詢	還是您有身份證字號幫您做查詢	還是您有身分證幫您做查詢			
6355	821195001512380	24	嗯身分證號碼那我不知道咧我我兒子的	嗯身分證號碼那我不知道咧我我兒子的	嗯身分證號碼我不知道咧我我兒子的			
6356	821195001512380	25	驫林訝唉啊是台灣的T還是維他露P的P	驫林訝唉啊是台灣的T還是維他露P的P	驫林訝唉啊是台灣還是維他露P的P			
6357	821195001512380	26	T就是唉就T就是T嘛	T就是唉就可以就是T嗎	七九六T就是T嗎不是唉寄一九四七嗎			
6358	821195001512380	27	像鐵丁的那個T吼	像鐵丁的那個七吼	像鐵丁的那個七			
6359	821195001512380	28	然後曲線的S	然後曲線的S	現在			
6360	821195001512380	29	然後dash三一八零	然後帶三一八零	然後帶是三一八零			
6361	821195001512380	30	這個這一台車子的車主並不是您說的名字唉	這個這一台車子的車主並不是您說的名字唉	這個這一台車子的車主D我的名字			
6362	821195001512380	31	是啊張家政啊	是啊張家政啊	家政啊			
6363	821195001512380	32	您線上稍等您的所在地在哪裡	您線上稍等您的所在的在哪裡	您先稍等您的所在的在			
6364	821195001512380	33	好您線上稍等不要掛斷謝謝您	好您線上稍等不要掛斷謝謝您	好您線上是要打斷謝謝您			
6365	821195001512655	1	不好意思再稍等一下喔	不好意思再稍等一下喔	不好意思再吼			
6366	821195001512614	1	公路總局用路人服務中心您好敝姓吳很高興為你服務	公路總局用路人服務中心您好敝姓吳很高興為你服務	公路總局用路人服務中心吳很高服務			
6367	821195001512614	2	是先請教您貴姓怎麼稱呼	是先請教您貴姓怎麼稱呼	是您貴姓怎麼稱呼			
